tcpdump: verbose output suppressed, use -v or -vv for full protocol decode
listening on en0, link-type EN10MB (Ethernet), capture size 65535 bytes
17:19:54.957521 IP ec2-184-73-212-5.compute-1.amazonaws.com.http > 10.26.22.203.59287: Flags [F.], seq 2237117405, ack 2427802284, win 114, options [nop,nop,TS val 331833918 ecr 678966828], length 0
E..4..@.@....I..
....P...W....R....r.......
..b>(x6,
17:19:54.957609 IP 10.26.22.203.59287 > ec2-184-73-212-5.compute-1.amazonaws.com.http: Flags [.], ack 1, win 8203, options [nop,nop,TS val 679025358 ecr 331833918], length 0
E..4..@.@...
....I.....P..R..W.... ..Z.....
(y....b>
17:19:54.958906 IP ec2-184-73-212-5.compute-1.amazonaws.com.http > 10.26.22.203.59285: Flags [F.], seq 1194385658, ack 954415220, win 114, options [nop,nop,TS val 331833920 ecr 678966820], length 0
E..4..@.@....I..
....P..G0..8.8t...rs
.....
..b@(x6$
17:19:54.958939 IP 10.26.22.203.59285 > ec2-184-73-212-5.compute-1.amazonaws.com.http: Flags [.], ack 1, win 8203, options [nop,nop,TS val 679025359 ecr 331833920], length 0
E..4.;@.@...
....I.....P8.8tG0.... ..Z.....
(y....b@
17:19:55.007763 IP learn.aorta.com.br.http > 10.26.22.203.46155: Flags [P.], seq 2605853151:2605853324, ack 2780717333, win 60, options [nop,nop,TS val 331833968 ecr 52100423], length 173
E...H.@.@.W.....
....P.K.R)...a....<cx.....
..bp...GHTTP/1.1 200 OK
Date: Mon, 25 Aug 2014 20:11:15 GMT
Content-Type: application/json
Keep-Alive: timeout=15, max=100
Connection: Keep-Alive
Transfer-Encoding: chunked


17:19:55.007767 IP learn.aorta.com.br.http > 10.26.22.203.46155: Flags [P.], seq 173:498, ack 1, win 60, options [nop,nop,TS val 331833968 ecr 52100423], length 325
E..yH.@.@.WQ....
....P.K.R*...a....<B......
..bp...G13e
[ { "_id" : "53f7558ee4b099dce2158f2e" , "name" : "Festival Presidente Mobi" , "eventRef" : "http://www.presidente.com.do/festival/" , "banner" : { "portrait" : "http://mobiconnecthmg.tabstudio.mobi/br.com.aorta.service.image/image/RadioPresidente/Adhoc/imagens/Base/53fa0bace4b098e8c8c96533.img" , "landscape" : ""}}]

17:19:55.007770 IP learn.aorta.com.br.http > 10.26.22.203.46155: Flags [P.], seq 498:503, ack 1, win 60, options [nop,nop,TS val 331833968 ecr 52100423], length 5
E..9H.@.@.X.....
....P.K.R+...a....<.......
..bp...G0


17:19:55.073945 IP 10.26.22.203.46155 > learn.aorta.com.br.http: Flags [.], ack 173, win 62, options [nop,nop,TS val 52100464 ecr 331833968], length 0
E..4.R@.?...
........K.P..a..R*....>.......
...p..bp
17:19:55.086799 IP 10.26.22.203.46155 > learn.aorta.com.br.http: Flags [.], ack 498, win 66, options [nop,nop,TS val 52100466 ecr 331833968], length 0
E..4.S@.?...
........K.P..a..R+....B.......
...r..bp
17:19:55.094355 IP 10.26.22.203.46155 > learn.aorta.com.br.http: Flags [.], ack 503, win 66, options [nop,nop,TS val 52100466 ecr 331833968], length 0
E..4.T@.?...
........K.P..a..R+....B.......
...r..bp
17:19:55.187041 IP 10.26.22.203.40244 > learn.aorta.com.br.http: Flags [F.], seq 651912674, ack 372366560, win 82, options [nop,nop,TS val 52100477 ecr 331832666], length 0
E..4.t@.?...
........4.P&.e..1.....RN......
...}..]Z
17:19:55.188383 IP 10.26.22.203.34649 > learn.aorta.com.br.http: Flags [F.], seq 88951158, ack 453213723, win 62, options [nop,nop,TS val 52100477 ecr 331833312], length 0
E..4.B@.?...
........Y.P.MIv..~....>.a.....
...}.._.
17:19:55.190180 IP 10.26.22.203.46155 > learn.aorta.com.br.http: Flags [F.], seq 1, ack 503, win 66, options [nop,nop,TS val 52100477 ecr 331833968], length 0
E..4.U@.?...
........K.P..a..R+....B.......
...}..bp
17:19:55.226899 IP learn.aorta.com.br.http > 10.26.22.203.40244: Flags [.], ack 1, win 54, options [nop,nop,TS val 331834188 ecr 52100477], length 0
E..4.]@.@.......
....P.4.1..&.e....6H5.....
..cL...}
17:19:55.228881 IP learn.aorta.com.br.http > 10.26.22.203.34649: Flags [.], ack 1, win 54, options [nop,nop,TS val 331834190 ecr 52100477], length 0
E..4#.@.@.}.....
....P.Y..~..MIw...6.......
..cN...}
17:19:55.229866 IP learn.aorta.com.br.http > 10.26.22.203.46155: Flags [.], ack 2, win 60, options [nop,nop,TS val 331834191 ecr 52100477], length 0
E..4H.@.@.X.....
....P.K.R+...a....<.......
..cO...}
17:19:55.252237 IP 10.26.22.203.59388 > www.rdio.com.http: Flags [.], seq 2024523479:2024527859, ack 3157111411, win 8192, options [nop,nop,TS val 679025651 ecr 331830907], length 4380
E..P..@.@...
..........Px....-.s.. ..N.....
(y....V{POST /api/1/recordClientStats HTTP/1.1
Host: www.rdio.com
User-Agent: Mozilla/5.0 (Macintosh; Intel Mac OS X 10.9; rv:31.0) Gecko/20100101 Firefox/31.0
Accept: text/plain, */*; q=0.01
Accept-Language: pt-BR,pt;q=0.8,en-US;q=0.5,en;q=0.3
Accept-Encoding: gzip, deflate
Content-Type: application/x-www-form-urlencoded; charset=UTF-8
X-Requested-With: XMLHttpRequest
Referer: http://www.rdio.com/search/Team%20me/
Content-Length: 3348
Cookie: optimizelySegments=%7B%22336009408%22%3A%22ff%22%2C%22338722019%22%3A%22referral%22%2C%22338756012%22%3A%22false%22%7D; optimizelyEndUserId=oeu1395410728606r0.6527429361346035; optimizelyBuckets=%7B%7D; fbm_100322856680770=base_domain=.www.rdio.com; s_fid=0E08BED5B44DB72C-0444715F5038467F; r=.eJyrVorPyU9OzElVslLIK83J0VFQigexjQ1NTc0sjcxA_FIg39DS0tgAwi0Dcg1qAcv9Do8.5y0MYs3vq_xMyHNDa50JOKYhzzs; _a="eyJkYXRlX2Nvb2tpZWQiOiAxMzk3NTk1ODQ3LCAicmVmIjogImh0dHA6Ly9lbWlsaWFuby5ib2NhbXVjaGFzLm9yZy9yZGlvLyIsICJyZXEiOiAiaHR0cDovL3d3dy5yZGlvLmNvbS9hcGkvc3dmLyIsICJ0eXBlIjogIm9yZ2FuaWMiLCAidWEiOiAiZGVza3RvcCIsICJtdWlkIjogImZhZjE0ZGNmNzIzYzgwOTIyZjhiY2NkZjkyZjU1NGIyY2U2NmM0ZDAifQ=="; ajs_user_id=1993026; ajs_group_id=null; _sio=476dd2fe-d7fd-453d-b3e9-b091209de308----1993026; _ga=GA1.1.1023500072.1397572294; amplitude_id=eyJkZXZpY2VJZCI6Ijk2ZDQwNWE1YWYxMTFiZDI4YmZhYjdiOTU3M2YyMTAyIiwidXNlcklkIjoiMTk5MzAyNiIsImdsb2JhbFVzZXJQcm9wZXJ0aWVzIjp7ImNyZWF0ZWQiOiIyMDEyLTA1LTI5VDE2OjQyOjQzLjAwMFoiLCJlbWFpbCI6ImVtaWxpYW5vZWxvaUBnbWFpbC5jb20iLCJmaXJzdE5hbWUiOiJFbWlsaWFubyIsImxhc3ROYW1lIjoiRWxvaSBTLiBCYXJib3NhIiwidXNlcm5hbWUiOiJlbWlsaWFub2Vsb2kiLCJnZW5kZXIiOiJtIiwibG9jYWxlIjpudWxsLCJsb2dnZWRJbiI6dHJ1ZSwiY29tcGQiOmZhbHNlLCJzdWJTdGF0dXMiOiJ1bmxpbWl0ZWQiLCJtdXNpY0ZlZWQiOmZhbHNlLCJ1c2VyRE1BQ29kZSI6bnVsbCwiY291bnRyeUNvZGUiOiJCUiIsInJlZ2lvbiI6IkJSIiwiaWQiOjE5OTMwMjZ9fQ==; __qca=P0-1261615019-1397572361567; _sio=86d59868-4618-4b82-a2e9-bcf7853d045a----1993026; mp_e7a2e1a771143fbc6737076d26155f0f_mixpanel=%7B%22distinct_id%22%3A%201993026%2C%22%24initial_referrer%22%3A%20%22%24direct%22%2C%22%24initial_referring_domain%22%3A%20%22%24direct%22%2C%22mp_name_tag%22%3A%20%22emilianoeloi%40gmail.com%22%2C%22gender%22%3A%20%22m%22%2C%22locale%22%3A%20null%2C%22loggedIn%22%3A%20true%2C%22compd%22%3A%20false%2C%22subStatus%22%3A%20%22unlimited%22%2C%22id%22%3A%201993026%2C%22%24created%22%3A%20%222012-05-29T16%3A42%3A43.000Z%22%2C%22%24email%22%3A%20%22emilianoeloi%40gmail.com%22%2C%22%24first_name%22%3A%20%22Emiliano%22%2C%22%24last_name%22%3A%20%22Eloi%20S.%20Barbosa%22%2C%22%24name%22%3A%20%22Emiliano%20Eloi%20S.%20Barbosa%22%2C%22%24username%22%3A%20%22emilianoeloi%22%7D; optimizelyCustomEvents=%7B%22oeu1395410728606r0.6527429361346035%22%3A%5B%22main_search_focus%22%5D%7D; user_segment=Prospect; _ap=%7B%22t%22%3A1408971397862%7D; s_cc=true; s_sq=%5B%5BB%5D%5D; fbsr_100322856680770=9po4dz5A5Cupe-qwc8D5ioog9TFMmBmsH4BDrFSj20o.eyJhbGdvcml0aG0iOiJITUFDLVNIQTI1NiIsImNvZGUiOiJBUURmR2I0d0V6R0NfVnBldDNoS2dOV2xJd3J3UXdvNGtpUE1udndaaWp4cmJUb1VabmNHNkpZdmNlRXR4UzRvZlZoYjJoUXlENXZkWGpsOGdaZjBnZ0o4OUtpODVscmMzYTNkc0s0eTdOWWJ6aEpIY3dyYjlVRk9Ec0tsMEhpTGRiZTR4bDB0TFVBRTdrXzQ2Tzl1bHVoUmxSUkVhYTgzWi1YN1NET3Nhc3FBZUE3cWtWN1g0Snk1a0cxLWstbWNDajFrLUJYTi1GeHFYcDI4STFBSmNmbnAxcHZvWkcwLTN2UklrN0FERHI2c2xJUE9QdGpZVXlacF9LOHNVVEVOM2JtRVZNRWhZRDIzd0V0d1pNVTM4WEtTbEJ2OHdjRi1pVnFBVUZJM1dEMjBCS3BwWlpseWJuS3I0VFk4YjNrc1JwbEtKRTBqdFk2UVdjMXNQbE44ME41QyIsImlzc3VlZF9hdCI6MTQwODk5NzgzNSwidXNlcl9pZCI6IjEwNDE4NzQxNTEifQ
Connection: keep-alive
Pragma: no-cache
Cache-Control: no-cache

graphiteStats=%5B%7B%22bucket%22%3A%22player.loadeddata.Firefox%22%2C%22stat%22%3A%221038%7Cms%22%2C%22timestamp%22%3A%222014-08-25T20%3A19%3A45.577Z%22%2C%22metadata%22%3A%7B%22string%22%3A%7B%22page_name%22%3A%22perfService%22%7D%2C%22integer%22%3A%7B%22page_start%22%3A26589894%2C%22page_end%22%3A26590932%7D%7D%7D%2C%7B%22bucket%22%3A%22player.play_delay.Firefox%22%2C%22stat%22%3A%221339%7Cms%22%2C%22timestamp%22%3A%222014-08-25T20%3A19%3A46.615Z%22%2C%22metadata%22%3A%7B%22string%22%3A%7B%22user%22%3A%22s1993026%22%2C%22preload%22%3A%22n%22%2C%22player_type%22%3A%22flash%22%2C%22streamHost%22%3A%22fms.25AC.edgecastcdn.net%22%2C%22streamUrl%22%3A%22s%2Fmusic%2Fb%2F9%2F3%2F9%2Fb939997775a9499c803efadda07ace48%2Ffull-192%3F80e2d2f4276a71565175a1c15d3f54afa75b3b2c9d58dd8727a00b961467ba872774ef6c3c7fe456c1bdea128c513c575e33d90f952d9f9d290bd0dea2d24c2de5f7
17:19:55.253484 IP www.rdio.com.http > 10.26.22.203.59388: Flags [.], ack 1448, win 295, options [nop,nop,TS val 331834214 ecr 679025651], length 0
E..4.Y@.@.._....
....P...-.sx......')......
..cf(y..
17:19:55.253486 IP www.rdio.com.http > 10.26.22.203.59388: Flags [.], ack 2896, win 317, options [nop,nop,TS val 331834214 ecr 679025651], length 0
E..4.Z@.@..^....
....P...-.sx..'...=$......
..cf(y..
17:19:55.253487 IP www.rdio.com.http > 10.26.22.203.59388: Flags [.], ack 4344, win 340, options [nop,nop,TS val 331834214 ecr 679025651], length 0
E..4.[@.@..]....
....P...-.sx......T.[.....
..cf(y..
17:19:55.253488 IP www.rdio.com.http > 10.26.22.203.59388: Flags [.], ack 4380, win 340, options [nop,nop,TS val 331834214 ecr 679025651], length 0
E..4.\@.@..\....
....P...-.sx......T.7.....
..cf(y..
17:19:55.253561 IP 10.26.22.203.59388 > www.rdio.com.http: Flags [P.], seq 4380:6863, ack 1, win 8192, options [nop,nop,TS val 679025652 ecr 331834214], length 2483
E.	.ez@.@...
..........Px....-.s.. ........
(y....cf9a7e80b4f43536841e50553fb4891fdcfc2133e6003f62a9764e55426ed223d2451c7cacee2381b047a5180cbb279d3a5d4490681450c25bef95a6%22%2C%22cdn%22%3A%22edgecast%22%2C%22flashVersion%22%3A%2214.0.0%22%2C%22page_name%22%3A%22perfService%22%7D%2C%22integer%22%3A%7B%22flashVersionMajor%22%3A14%2C%22flashVersionMinor%22%3A0%2C%22flashVersionRelease%22%3A0%2C%22browserVersion%22%3A31%2C%22page_start%22%3A26590932%2C%22page_end%22%3A26592271%7D%2C%22wantsRequestInfo%22%3Atrue%2C%22samplingRule%22%3A%22play_delay_timer%22%7D%7D%2C%7B%22bucket%22%3A%22player.create_flash.Firefox%22%2C%22stat%22%3A%221%7Cc%22%2C%22metadata%22%3A%7B%22dataset%22%3A%22rdio%22%2C%22subset%22%3A%22client_counters%22%7D%7D%5D&snorkelSamples=%5B%7B%22clientTimestamp%22%3A1408997985568%2C%22samplingRule%22%3A%22rdio_playback%22%2C%22string%22%3A%7B%22event_type%22%3A%22create%22%2C%22user%22%3A%22s1993026%22%2C%22player_type%22%3A%22flash%22%2C%22streamHost%22%3A%22fms.25AC.edgecastcdn.net%22%2C%22streamUrl%22%3A%22s%2Fmusic%2Fb%2F9%2F3%2F9%2Fb939997775a9499c803efadda07ace48%2Ffull-192%3F80e2d2f4276a71565175a1c15d3f54afa75b3b2c9d58dd8727a00b961467ba872774ef6c3c7fe456c1bdea128c513c575e33d90f952d9f9d290bd0dea2d24c2de5f79a7e80b4f43536841e50553fb4891fdcfc2133e6003f62a9764e55426ed223d2451c7cacee2381b047a5180cbb279d3a5d4490681450c25bef95a6%22%2C%22cdn%22%3A%22edgecast%22%2C%22flashVersion%22%3A%2214.0.0%22%2C%22playingSource%22%3A%22tr1413811%22%2C%22playingTrack%22%3A%22t22428911%22%2C%22shuffle%22%3Afalse%2C%22station%22%3A%22tr1413811%22%7D%2C%22integer%22%3A%7B%22flashVersionMajor%22%3A14%2C%22flashVersionMinor%22%3A0%2C%22flashVersionRelease%22%3A0%2C%22browserVersion%22%3A31%2C%22sourcePosition%22%3A11%2C%22playState%22%3A1%2C%22position%22%3A0%2C%22repeat%22%3A2%7D%2C%22dataset%22%3A%22rdio%22%2C%22subset%22%3A%22playback%22%2C%22wantsRequestInfo%22%3Atrue%7D%2C%7B%22clientTimestamp%22%3A1408997985955%2C%22samplingRule%22%3A%22racoon_loader%22%2C%22string%22%3A%7B%22component%22%3A%22Track.DragProxy%22%2C%22state%22%3A%22alreadyLoaded%22%2C%22page%22%3A%22%2Fsearch%2FTeam%2520me%2F%22%2C%22user%22%3A%22s1993026%22%2C%22target%22%3A%22rdio%22%7D%2C%22integer%22%3A%7B%22requestCount%22%3A142%7D%2C%22dataset%22%3A%22racoon%22%2C%22subset%22%3A%22loader%22%7D%5D&revision=2ddcc924748661504ddc8a6b82072c652e74f5e4&extras%5B%5D=*.WEB&method=recordClientStats&_authorization_key=eyJyYW5kIjogODgyMDU1MjQ0LCAia2V5IjogInMxOTkzMDI2IiwgInRpbWUiOiAxNDA4OTcxMzk0fQ.oGMzH9Dke3oKgYhK5_iWTBxZqzI&v=20140806
17:19:55.254601 IP www.rdio.com.http > 10.26.22.203.59388: Flags [.], ack 5828, win 362, options [nop,nop,TS val 331834215 ecr 679025652], length 0
E..4.]@.@..[....
....P...-.sx......j.w.....
..cg(y..
17:19:55.254602 IP www.rdio.com.http > 10.26.22.203.59388: Flags [.], ack 6863, win 385, options [nop,nop,TS val 331834215 ecr 679025652], length 0
E..4.^@.@..Z....
....P...-.sx........U.....
..cg(y..
17:19:55.359080 IP ec2-54-209-59-137.compute-1.amazonaws.com.http > 10.26.22.203.59303: Flags [F.], seq 2449191335, ack 871817395, win 59, options [nop,nop,TS val 331834320 ecr 678967123], length 0
E..4..@.@..h6.;.
....P......3......;.......
..c.(x7S
17:19:55.359151 IP 10.26.22.203.59303 > ec2-54-209-59-137.compute-1.amazonaws.com.http: Flags [.], ack 1, win 8198, options [nop,nop,TS val 679025757 ecr 331834320], length 0
E..4j#@.@...
...6.;....P3......... ..e.....
(y.]..c.
17:19:55.438705 IP 10.26.22.203.59385 > www.rdio.com.http: Flags [.], ack 4095414, win 8210, length 0
E..(....@...
..........P.....>}.P. ..%..
17:19:55.439217 IP www.rdio.com.http > 10.26.22.203.59385: Flags [.], ack 1, win 114, options [nop,nop,TS val 331834400 ecr 679015793], length 0
E..4F)@.@.......
....P...>}........r.......
..d (x.q
17:19:55.507837 IP learn.aorta.com.br.http > 10.26.22.203.34649: Flags [F.], seq 1, ack 1, win 54, options [nop,nop,TS val 331834469 ecr 52100477], length 0
E..4#.@.@.}.....
....P.Y..~..MIw...6.......
..de...}
17:19:55.511185 IP learn.aorta.com.br.http > 10.26.22.203.40244: Flags [F.], seq 1, ack 1, win 54, options [nop,nop,TS val 331834472 ecr 52100477], length 0
E..4.^@.@.......
....P.4.1..&.e....6G......
..dh...}
17:19:55.518936 IP learn.aorta.com.br.http > 10.26.22.203.46155: Flags [F.], seq 503, ack 2, win 60, options [nop,nop,TS val 331834480 ecr 52100477], length 0
E..4H.@.@.X.....
....P.K.R+...a....<.......
..dp...}
17:19:55.546502 IP 10.26.22.203.34649 > learn.aorta.com.br.http: Flags [.], ack 2, win 62, options [nop,nop,TS val 52100513 ecr 331834469], length 0
E..4..@.?...
........Y.P.MIw..~....>.......
......de
17:19:55.558549 IP 10.26.22.203.40244 > learn.aorta.com.br.http: Flags [.], ack 2, win 82, options [nop,nop,TS val 52100513 ecr 331834472], length 0
E..4..@.?...
........4.P&.e..1.....RF......
......dh
17:19:55.561855 IP 10.26.22.203.46155 > learn.aorta.com.br.http: Flags [.], ack 504, win 66, options [nop,nop,TS val 52100513 ecr 331834480], length 0
E..4..@.?...
........K.P..a..R+....B.......
......dp
17:19:55.567336 IP ec2-23-21-167-14.compute-1.amazonaws.com.http > 10.26.22.203.59289: Flags [F.], seq 1434917562, ack 3612498389, win 114, options [nop,nop,TS val 331834528 ecr 678966870], length 0
E..4`:@.@.......
....P..U....RY....r6......
..d.(x6V
17:19:55.567414 IP 10.26.22.203.59289 > ec2-23-21-167-14.compute-1.amazonaws.com.http: Flags [.], ack 1, win 8224, options [nop,nop,TS val 679025964 ecr 331834528], length 0
E..4>.@.@...
..........P.RY.U.....  .......
(y.,..d.
17:19:55.568879 IP ec2-23-21-167-14.compute-1.amazonaws.com.http > 10.26.22.203.59288: Flags [F.], seq 2163539533, ack 1042360084, win 114, options [nop,nop,TS val 331834529 ecr 678966876], length 0
E..4..@.@.......
....P.....M>!'....r.......
..d.(x6\
17:19:55.568916 IP 10.26.22.203.59288 > ec2-23-21-167-14.compute-1.amazonaws.com.http: Flags [.], ack 1, win 8224, options [nop,nop,TS val 679025965 ecr 331834529], length 0
E..4..@.@...
..........P>!'....N..  .......
(y.-..d.
17:19:55.657311 IP www.rdio.com.http > 10.26.22.203.59388: Flags [P.], seq 1:362, ack 6863, win 385, options [nop,nop,TS val 331834618 ecr 679025652], length 361
E...._@.@.......
....P...-.sx.......Zl.....
..d.(y..HTTP/1.1 200 OK
Server: nginx/1.2.4
Date: Mon, 25 Aug 2014 20:19:55 GMT
Content-Type: application/json
Content-Length: 32
Connection: keep-alive
X-srv: srv-207-09
X-Client-Version: 2ddcc924748661504ddc8a6b82072c652e74f5e4
Content-Language: pt-br
Vary: Accept-Language, Cookie
Cache-Control: no-cache
Access-Control-Allow-Origin: *
X-Version: 720


17:19:55.657315 IP www.rdio.com.http > 10.26.22.203.59388: Flags [P.], seq 362:394, ack 6863, win 385, options [nop,nop,TS val 331834618 ecr 679025652], length 32
E..T.`@.@..8....
....P...-..x..............
..d.(y..{"status": "ok", "result": null}
17:19:55.657397 IP 10.26.22.203.59388 > www.rdio.com.http: Flags [.], ack 362, win 8169, options [nop,nop,TS val 679026052 ecr 331834618], length 0
E..4..@.@...
..........Px....-.......1.....
(y....d.
17:19:55.657425 IP 10.26.22.203.59388 > www.rdio.com.http: Flags [.], ack 394, win 8167, options [nop,nop,TS val 679026052 ecr 331834618], length 0
E..4..@.@...
..........Px....-.......1.....
(y....d.
17:19:55.739973 IP 10.26.22.203.59389 > www.rdio.com.http: Flags [.], ack 1621201640, win 8192, length 0
E..(.|..@...
..........P.E..`...P. ..%..
17:19:55.740506 IP www.rdio.com.http > 10.26.22.203.59389: Flags [.], ack 1, win 114, options [nop,nop,TS val 331834701 ecr 679016101], length 0
E..4..@.@.......
....P..`....E.....r.A.....
..eM(x..
17:19:56.342413 IP 10.26.22.203.59392 > a23-201-103-152.deploy.static.akamaitechnologies.com.http: Flags [.], ack 437902217, win 8192, length 0
E..(.F..@...
.....g....Pf2\.....P. ..`..
17:19:56.342443 IP 10.26.22.203.59390 > www.rdio.com.http: Flags [.], ack 2491762339, win 8208, length 0
E..(e...@...
..........Pi.....F.P. ..%..
17:19:56.342918 IP a23-201-103-152.deploy.static.akamaitechnologies.com.http > 10.26.22.203.59392: Flags [.], ack 1, win 55, options [nop,nop,TS val 331835304 ecr 679016691], length 0
E..4..@.@..z..g.
....P......f2\....7.M.....
..g.(x..
17:19:56.342920 IP www.rdio.com.http > 10.26.22.203.59390: Flags [.], ack 1, win 114, options [nop,nop,TS val 331835304 ecr 679016645], length 0
E..4..@.@.......
....P....F.i......r.......
..g.(x..
17:19:56.643332 IP cf-190-93-244-58.cloudflare.com.http > 10.26.22.203.59360: Flags [F.], seq 2432881609, ack 1015897249, win 62, options [nop,nop,TS val 331835604 ecr 678981362], length 0
E..4i.@.@..n.].:
....P......<.\....>.......
..h.(xn.
17:19:56.643414 IP 10.26.22.203.59360 > cf-190-93-244-58.cloudflare.com.http: Flags [.], ack 1, win 8192, options [nop,nop,TS val 679027033 ecr 331835604], length 0
E..4..@.@...
....].:...P<.\....... ........
(y!Y..h.
17:19:56.827765 IP 10.26.22.203.59192 > ec2-174-129-22-129.compute-1.amazonaws.com.http: Flags [F.], seq 3557920048, ack 3216653758, win 8197, options [nop,nop,TS val 679027217 ecr 331828506], length 0
E..4.W@.@...
........8.P...0..=... .......
(y"...M.
17:19:56.827839 IP 10.26.22.203.59289 > ec2-23-21-167-14.compute-1.amazonaws.com.http: Flags [F.], seq 1, ack 1, win 8224, options [nop,nop,TS val 679027217 ecr 331834528], length 0
E..4..@.@...
..........P.RY.U.....  .......
(y"...d.
17:19:56.827870 IP 10.26.22.203.59288 > ec2-23-21-167-14.compute-1.amazonaws.com.http: Flags [F.], seq 1, ack 1, win 8224, options [nop,nop,TS val 679027217 ecr 331834529], length 0
E..4S.@.@...
..........P>!'....N..  .......
(y"...d.
17:19:56.827921 IP 10.26.22.203.59354 > cf-190-93-244-58.cloudflare.com.http: Flags [F.], seq 2422906789, ack 4120825301, win 8192, options [nop,nop,TS val 679027217 ecr 331833121], length 0
E..4..@.@...
....].:...P.j........ ........
(y"..._!
17:19:56.827940 IP ec2-174-129-22-129.compute-1.amazonaws.com.http > 10.26.22.203.59192: Flags [.], ack 1, win 57, options [nop,nop,TS val 331835789 ecr 679027217], length 0
E..4_7@.@.......
....P.8..=....1...9.y.....
..i.(y".
17:19:56.827988 IP 10.26.22.203.59360 > cf-190-93-244-58.cloudflare.com.http: Flags [F.], seq 1, ack 1, win 8192, options [nop,nop,TS val 679027217 ecr 331835604], length 0
E..4b.@.@...
....].:...P<.\....... ........
(y"...h.
17:19:56.828025 IP 10.26.22.203.59285 > ec2-184-73-212-5.compute-1.amazonaws.com.http: Flags [F.], seq 1, ack 1, win 8203, options [nop,nop,TS val 679027217 ecr 331833920], length 0
E..4.X@.@...
....I.....P8.8tG0.... ..Z.....
(y"...b@
17:19:56.828048 IP 10.26.22.203.59287 > ec2-184-73-212-5.compute-1.amazonaws.com.http: Flags [F.], seq 1, ack 1, win 8203, options [nop,nop,TS val 679027217 ecr 331833918], length 0
E..4g.@.@...
....I.....P..R..W.... ..Z.....
(y"...b>
17:19:56.828078 IP 10.26.22.203.59303 > ec2-54-209-59-137.compute-1.amazonaws.com.http: Flags [F.], seq 1, ack 1, win 8198, options [nop,nop,TS val 679027217 ecr 331834320], length 0
E..4_e@.@...
...6.;....P3......... ..e.....
(y"...c.
17:19:56.828124 IP 10.26.22.203.59264 > ec2-54-243-51-62.compute-1.amazonaws.com.http: Flags [F.], seq 1893708538, ack 695482002, win 8220, options [nop,nop,TS val 679027217 ecr 331833383], length 0
E..4.t@.@...
...6.3>...Pp...)t6... ..<.....
(y"...`'
17:19:56.828204 IP 10.26.22.203.59203 > c911a5b7.virtua.com.br.http: Flags [F.], seq 146742787, ack 1355143354, win 8208, options [nop,nop,TS val 679027217 ecr 331830186], length 0
E..4..@.@...
........C.P....P..... ........
(y"...S.
17:19:56.828228 IP 10.26.22.203.59201 > c911a5b7.virtua.com.br.http: Flags [F.], seq 4073397869, ack 1007069376, win 8192, options [nop,nop,TS val 679027217 ecr 331830236], length 0
E..4gw@.@...
........A.P...m<..... ........
(y"...S.
17:19:56.828253 IP 10.26.22.203.59207 > c911a5b7.virtua.com.br.http: Flags [F.], seq 3189813727, ack 2366382173, win 8208, options [nop,nop,TS val 679027217 ecr 331830230], length 0
E..4f%@.@...
........G.P. .... ].. ........
(y"...S.
17:19:56.828814 IP ec2-23-21-167-14.compute-1.amazonaws.com.http > 10.26.22.203.59289: Flags [.], ack 2, win 114, options [nop,nop,TS val 331835789 ecr 679027217], length 0
E..4`;@.@.......
....P..U....RY....rF......
..i.(y".
17:19:56.828815 IP ec2-23-21-167-14.compute-1.amazonaws.com.http > 10.26.22.203.59288: Flags [.], ack 2, win 114, options [nop,nop,TS val 331835789 ecr 679027217], length 0
E..4..@.@.......
....P.....N>!'....r.......
..i.(y".
17:19:56.828816 IP cf-190-93-244-58.cloudflare.com.http > 10.26.22.203.59354: Flags [.], ack 1, win 71, options [nop,nop,TS val 331835789 ecr 679027217], length 0
E..4p.@.@..w.].:
....P.......j.....G.i.....
..i.(y".
17:19:56.828817 IP cf-190-93-244-58.cloudflare.com.http > 10.26.22.203.59360: Flags [.], ack 2, win 62, options [nop,nop,TS val 331835789 ecr 679027217], length 0
E..4i.@.@..m.].:
....P......<.\....>.......
..i.(y".
17:19:56.828818 IP ec2-184-73-212-5.compute-1.amazonaws.com.http > 10.26.22.203.59285: Flags [.], ack 2, win 114, options [nop,nop,TS val 331835789 ecr 679027217], length 0
E..4..@.@....I..
....P..G0..8.8u...r.......
..i.(y".
17:19:56.828820 IP ec2-184-73-212-5.compute-1.amazonaws.com.http > 10.26.22.203.59287: Flags [.], ack 2, win 114, options [nop,nop,TS val 331835789 ecr 679027217], length 0
E..4..@.@....I..
....P...W....R....r.......
..i.(y".
17:19:56.828821 IP ec2-54-209-59-137.compute-1.amazonaws.com.http > 10.26.22.203.59303: Flags [.], ack 2, win 59, options [nop,nop,TS val 331835789 ecr 679027217], length 0
E..4..@.@..g6.;.
....P......3......;.......
..i.(y".
17:19:56.828822 IP ec2-54-243-51-62.compute-1.amazonaws.com.http > 10.26.22.203.59264: Flags [.], ack 1, win 59, options [nop,nop,TS val 331835789 ecr 679027217], length 0
E..4Ah@.@.nF6.3>
....P..)t6.p......;.......
..i.(y".
17:19:56.828823 IP c911a5b7.virtua.com.br.http > 10.26.22.203.59203: Flags [.], ack 1, win 62, options [nop,nop,TS val 331835789 ecr 679027217], length 0
E..4..@.@..l....
....P.CP..........>.......
..i.(y".
17:19:56.828824 IP c911a5b7.virtua.com.br.http > 10.26.22.203.59201: Flags [.], ack 1, win 116, options [nop,nop,TS val 331835789 ecr 679027217], length 0
E..4.k@.@.......
....P.A<......n...tA*.....
..i.(y".
17:19:56.828826 IP c911a5b7.virtua.com.br.http > 10.26.22.203.59207: Flags [.], ack 1, win 62, options [nop,nop,TS val 331835790 ecr 679027217], length 0
E..4v.@.@.4.....
....P.G.. ]. .....>.......
..i.(y".
17:19:57.008269 IP 10.26.22.203.59329 > a23-52-149-163.deploy.static.akamaitechnologies.com.http: Flags [F.], seq 1258180291, ack 475603420, win 8222, options [nop,nop,TS val 679027396 ecr 331776674], length 0
E..4..@.@...
....4.....PJ.N..Y!... ........
(y".....
17:19:57.048803 IP a23-52-149-163.deploy.static.akamaitechnologies.com.http > 10.26.22.203.59329: Flags [.], ack 1, win 54, options [nop,nop,TS val 331836010 ecr 679027396], length 0
E..4..@.@..>.4..
....P...Y!.J.N....6.S.....
..jj(y".
17:19:57.048867 IP 10.26.22.203.59329 > a23-52-149-163.deploy.static.akamaitechnologies.com.http: Flags [.], ack 1, win 8222, options [nop,nop,TS val 679027435 ecr 331836010], length 0
E..4Ec@.@...
....4.....PJ.N..Y!... ........
(y"...jj
17:19:57.302208 IP a23-52-149-163.deploy.static.akamaitechnologies.com.http > 10.26.22.203.59329: Flags [F.], seq 1, ack 1, win 54, options [nop,nop,TS val 331836263 ecr 679027435], length 0
E..4..@.@..=.4..
....P...Y!.J.N....6.......
..kg(y".
17:19:57.302302 IP 10.26.22.203.59329 > a23-52-149-163.deploy.static.akamaitechnologies.com.http: Flags [.], ack 2, win 8222, options [nop,nop,TS val 679027687 ecr 331836263], length 0
E..4.&@.@...
....4.....PJ.N..Y!... ........
(y#...kg
17:19:57.878286 IP 10.26.22.203.43891 > ec2-46-137-173-235.eu-west-1.compute.amazonaws.com.http: Flags [S], seq 3367190901, win 65535, options [mss 1460,nop,wscale 4,nop,nop,TS val 240725333 ecr 0,sackOK,eol], length 0
E..@	?@.?...
........s.P..Au........H
.............
.Y-U........
17:19:57.938879 IP ec2-54-225-216-126.compute-1.amazonaws.com.http > 10.26.22.203.59338: Flags [F.], seq 1773120518, ack 143506326, win 91, options [nop,nop,TS val 331836900 ecr 678969111], length 0
E..4(.@.@...6..~
....P..i..........[.......
..m.(x?.
17:19:57.938946 IP 10.26.22.203.59338 > ec2-54-225-216-126.compute-1.amazonaws.com.http: Flags [.], ack 1, win 8232, options [nop,nop,TS val 679028320 ecr 331836900], length 0
E..4.8@.@...
...6..~...P....i..... (0k.....
(y&`..m.
17:19:57.940124 IP ec2-54-225-216-126.compute-1.amazonaws.com.http > 10.26.22.203.59336: Flags [F.], seq 3454988151, ack 461636539, win 91, options [nop,nop,TS val 331836901 ecr 678969117], length 0
E..4l.@.@...6..~
....P.....w.......[.......
..m.(x?.
17:19:57.940142 IP 10.26.22.203.59336 > ec2-54-225-216-126.compute-1.amazonaws.com.http: Flags [.], ack 1, win 8232, options [nop,nop,TS val 679028321 ecr 331836901], length 0
E..4..@.@...
...6..~...P.......x.. (0k.....
(y&a..m.
17:19:57.955235 IP ec2-184-73-212-5.compute-1.amazonaws.com.http > 10.26.22.203.59286: Flags [F.], seq 1099265236, ack 3494987466, win 181, options [nop,nop,TS val 331836916 ecr 678969085], length 0
E..4
.@.@....I..
....P..A.t..QF.....*F.....
..m.(x>.
17:19:57.955291 IP 10.26.22.203.59286 > ec2-184-73-212-5.compute-1.amazonaws.com.http: Flags [.], ack 1, win 8192, options [nop,nop,TS val 679028335 ecr 331836916], length 0
E..4k.@.@...
....I.....P.QF.A.t... ..Z.....
(y&o..m.
17:19:58.030081 IP 10.26.22.203.46113 > 216.52.203.13.http: Flags [S], seq 3255353564, win 65535, options [mss 1460,nop,wscale 4,nop,nop,TS val 240725517 ecr 0,sackOK,eol], length 0
E..@.J@.?...
....4..!.P...........................
.Y.........
17:19:58.119669 IP ec2-54-244-225-86.us-west-2.compute.amazonaws.com.http > 10.26.22.203.59296: Flags [F.], seq 4168285972, ack 373916573, win 181, options [nop,nop,TS val 331837080 ecr 678969173], length 0
E..4.[@.@.z96..V
....P...r...I.......K.....
..n.(x?U
17:19:58.119758 IP 10.26.22.203.59296 > ec2-54-244-225-86.us-west-2.compute.amazonaws.com.http: Flags [.], ack 1, win 8212, options [nop,nop,TS val 679028499 ecr 331837080], length 0
E..4.x@.@...
...6..V...P.I...r.... .9V.....
(y'...n.
17:19:58.303726 IP ec2-46-137-173-235.eu-west-1.compute.amazonaws.com.http > 10.26.22.203.43891: Flags [S.], seq 1510839637, ack 3367190902, win 5792, options [mss 1460,sackOK,TS val 331837264 ecr 240725333,nop,wscale 7], length 0
E..<..@.@.=c....
....P.sZ.U..Av...............
..oP.Y-U....
17:19:58.362114 IP 216.52.203.13.http > 10.26.22.203.46113: Flags [S.], seq 1026353884, ack 3255353565, win 5792, options [mss 1460,sackOK,TS val 331837323 ecr 240725517,nop,wscale 7], length 0
E..<..@.@.v..4.
....P.!=,..........N..........
..o..Y.....
17:19:58.412007 IP 10.26.22.203.43891 > ec2-46-137-173-235.eu-west-1.compute.amazonaws.com.http: Flags [.], ack 1, win 8235, options [nop,nop,TS val 240725897 ecr 331837264], length 0
E..4..@.?...
........s.P..AvZ.V.. +.......
.Y/...oP
17:19:58.412245 IP 10.26.22.203.46113 > 216.52.203.13.http: Flags [.], ack 1, win 8235, options [nop,nop,TS val 240725897 ecr 331837323], length 0
E..4.$@.?...
....4..!.P....=,.... +q......
.Y/...o.
17:19:58.445508 IP 10.26.22.203.43891 > ec2-46-137-173-235.eu-west-1.compute.amazonaws.com.http: Flags [P.], seq 1:857, ack 1, win 8235, options [nop,nop,TS val 240725925 ecr 331837264], length 856
E.....@.?...
........s.P..AvZ.V.. +.q.....
.Y/...oPGET /api/v2.5/iosevent?app_id=604060270&data=6s9whl4XbJAPalZXq5AVqNKWbl9/qN1WbJ1LdoHRGlBIZficdoZAbX6lykqP1E39dsPidsZtx2OmdWP9K4tlykqP1E39djG910qIdW/tqp/zyNbLdstwGsVtx2OmdWP9yfzcYWHLxjI9GfBcGf2Lhs9SxftuGQzVdfHXGotMdlBIZficdoZMa54LYWtBd0391NXzbMziGkG9103I1W2MQsStq4bE3lZEqXSRqJ34qQXXqNSByliHaJwRS5S5SNiJSZ4E3JGCyf-Bdo3LGjG910qIdW/tbQ/5yf-Bdo3LGsPidsZtSWzBYoZAGf4ASWtMyf3i6fZzhlKVblSRbJARbN27blY5qMXVb5FVyf3i6fZMhlKVblSRbJARbN27bl1zqMXVb5FVyf3i6fZ5hlKVblSRbJARbN27blY5qMXVb5FVyfqB10-9d03bYsP06sH0GlBV6CzN6j-MGsPXSWtBd03MgsqcGfZtS9KL6f9RGjqXYsBVhl4XbJAPal1Pal1uqN4/q5ZMyf2WGsPXhZzi6sPNxf2wyf2WGsPX6oHL6sZtyk6IGowtsZ2lyfBiY5BJqJmMS5mVb5mEbJmBb5mzbMV=&buildnumber=1.9.3 HTTP/1.1
Host: track.appsflyer.com
Connection: keep-alive
Accept-Encoding: gzip, deflate
User-Agent: ClubeDaCor/1.3 CFNetwork/609.1.4 Darwin/13.0.0
Accept-Language: pt-br
Accept: */*


17:19:58.446322 IP ec2-46-137-173-235.eu-west-1.compute.amazonaws.com.http > 10.26.22.203.43891: Flags [.], ack 857, win 59, options [nop,nop,TS val 331837407 ecr 240725925], length 0
E..4..@.@.B.....
....P.sZ.V..D....;.......
..o..Y/.
17:19:58.461055 IP 10.26.22.203.46113 > 216.52.203.13.http: Flags [P.], seq 1:263, ack 1, win 8235, options [nop,nop,TS val 240725944 ecr 331837323], length 262
E..:.$@.?...
....4..!.P....=,.... +S......
.Y/...o.POST /aas.do HTTP/1.1
Host: data.flurry.com
Accept-Encoding: gzip, deflate
Content-Type: application/octet-stream
Content-Length: 299
Accept-Language: pt-br
Accept: */*
Connection: keep-alive
User-Agent: ClubeDaCor/1.3 CFNetwork/609.1.4 Darwin/13.0.0


17:19:58.461775 IP 216.52.203.13.http > 10.26.22.203.46113: Flags [.], ack 263, win 54, options [nop,nop,TS val 331837422 ecr 240725944], length 0
E..4.`@.@..<.4.
....P.!=,.........6.1.....
..o..Y/.
17:19:58.463171 IP 10.26.22.203.46113 > 216.52.203.13.http: Flags [P.], seq 263:562, ack 1, win 8235, options [nop,nop,TS val 240725945 ecr 331837323], length 299
E.._.j@.?...
....4..!.P....=,.... +.......
.Y/...o..................u...H..;...NX8378VGXFRMH6J7H5BK..1.3.....$4C7E577D-44D5-4645-8E89-C43B8CAA7D6B...$F071DB75-215F-4C50-B053-D7574BBA1336.....8....q.+)\..............w....c.B..s....Q..(....H...N...H..;d...
scr.height..480.	scr.width..320..device.os.version..6.1.3..device.model.1.	iPhone2,1.......$3xf
17:19:58.463779 IP 216.52.203.13.http > 10.26.22.203.46113: Flags [.], ack 562, win 62, options [nop,nop,TS val 331837425 ecr 240725945], length 0
E..4.a@.@..;.4.
....P.!=,.........>.......
..o..Y/.
17:19:58.852095 IP 216.52.203.13.http > 10.26.22.203.46113: Flags [P.], seq 1:150, ack 562, win 62, options [nop,nop,TS val 331837813 ecr 240725945], length 149
E....b@.@....4.
....P.!=,.........>Y......
..qu.Y/.HTTP/1.1 200 OK
Server: nginx
Date: Mon, 25 Aug 2014 20:19:58 GMT
Content-Type: application/octet-stream
Connection: close
Content-Length: 0


17:19:58.852670 IP 216.52.203.13.http > 10.26.22.203.46113: Flags [F.], seq 150, ack 562, win 62, options [nop,nop,TS val 331837813 ecr 240725945], length 0
E..4.c@.@..9.4.
....P.!=,.r.......>.......
..qu.Y/.
17:19:58.905273 IP ec2-46-137-173-235.eu-west-1.compute.amazonaws.com.http > 10.26.22.203.43891: Flags [P.], seq 1:173, ack 857, win 59, options [nop,nop,TS val 331837866 ecr 240725925], length 172
E.....@.@.A.....
....P.sZ.V..D....;.......
..q..Y/.HTTP/1.1 200 OK
Content-Type: application/json; charset=UTF-8
Date: Mon, 25 Aug 2014 20:19:58 GMT
Server: gunicorn/0.14.5
Content-Length: 16
Connection: keep-alive


17:19:58.905276 IP ec2-46-137-173-235.eu-west-1.compute.amazonaws.com.http > 10.26.22.203.43891: Flags [P.], seq 173:189, ack 857, win 59, options [nop,nop,TS val 331837866 ecr 240725925], length 16
E..D..@.@.Bm....
....P.sZ....D....;r......
..q..Y/.{"status": "ok"}
17:19:58.925374 IP 10.26.22.203.46113 > 216.52.203.13.http: Flags [.], ack 150, win 8226, options [nop,nop,TS val 240726402 ecr 331837813], length 0
E..47O@.?...
....4..!.P....=,.r.. "k4.....
.Y1...qu
17:19:58.925504 IP 10.26.22.203.46113 > 216.52.203.13.http: Flags [.], ack 151, win 8226, options [nop,nop,TS val 240726402 ecr 331837813], length 0
E..4..@.?...
....4..!.P....=,.s.. "k3.....
.Y1...qu
17:19:58.925807 IP 10.26.22.203.43891 > ec2-46-137-173-235.eu-west-1.compute.amazonaws.com.http: Flags [.], ack 173, win 8224, options [nop,nop,TS val 240726402 ecr 331837866], length 0
E..4.|@.?...
........s.P..D.Z....  .......
.Y1...q.
17:19:58.926397 IP 10.26.22.203.43891 > ec2-46-137-173-235.eu-west-1.compute.amazonaws.com.http: Flags [.], ack 189, win 8223, options [nop,nop,TS val 240726402 ecr 331837866], length 0
E..4.w@.?...
........s.P..D.Z.... ........
.Y1...q.
17:19:58.942803 IP ec2-54-225-216-126.compute-1.amazonaws.com.http > 10.26.22.203.59337: Flags [F.], seq 1536149412, ack 3309423010, win 136, options [nop,nop,TS val 331837904 ecr 678970431], length 0
E..4D.@.@...6..~
....P..[....A.......n.....
..q.(xD?
17:19:58.942887 IP 10.26.22.203.59337 > ec2-54-225-216-126.compute-1.amazonaws.com.http: Flags [.], ack 1, win 8229, options [nop,nop,TS val 679029319 ecr 331837904], length 0
E..41.@.@...
...6..~...P.A..[..... %0k.....
(y*G..q.
17:19:58.969517 IP 10.26.22.203.46113 > 216.52.203.13.http: Flags [F.], seq 562, ack 151, win 8226, options [nop,nop,TS val 240726443 ecr 331837813], length 0
E..4.o@.?...
....4..!.P....=,.s.. "k	.....
.Y1...qu
17:19:58.969998 IP 216.52.203.13.http > 10.26.22.203.46113: Flags [.], ack 563, win 62, options [nop,nop,TS val 331837931 ecr 240726443], length 0
E..4.d@.@..8.4.
....P.!=,.s.......>.w.....
..q..Y1.
17:19:59.943544 IP c911a5b7.virtua.com.br.http > 10.26.22.203.59206: Flags [F.], seq 2422118520, ack 4019640843, win 136, options [nop,nop,TS val 331838904 ecr 678970827], length 0
E..4.]@.@.......
....P.F.^.x...............
..u.(xE.
17:19:59.943628 IP 10.26.22.203.59206 > c911a5b7.virtua.com.br.http: Flags [.], ack 1, win 8192, options [nop,nop,TS val 679030317 ecr 331838904], length 0
E..4.j@.@...
........F.P.....^.y.. ........
(y.-..u.
17:20:00.282086 IP 131.253.40.50.http > 10.26.22.203.59343: Flags [F.], seq 416140591, ack 3960269885, win 55, options [nop,nop,TS val 331839243 ecr 678970604], length 0
E..4B.@.@.+...(2
....P...../...=...7
......
..w.(xD.
17:20:00.282089 IP 131.253.40.50.http > 10.26.22.203.59343: Flags [R.], seq 1, ack 1, win 55, options [nop,nop,TS val 331839243 ecr 678970604], length 0
E..4B.@.@.+...(2
....P.....0...=...7
......
..w.(xD.
17:20:00.282171 IP 10.26.22.203.59343 > 131.253.40.50.http: Flags [.], ack 1, win 8195, options [nop,nop,TS val 679030653 ecr 331839243], length 0
E..4..@.@...
.....(2...P...=...0.. ..:.....
(y/}..w.
17:20:00.282666 IP 131.253.40.50.http > 10.26.22.203.59343: Flags [R], seq 416140592, win 0, length 0
E..(..@.@.m...(2
....P.....0....P.............
17:20:00.663904 IP 131.253.40.50.http > 10.26.22.203.59342: Flags [F.], seq 2125444600, ack 3987675566, win 65, options [nop,nop,TS val 331839624 ecr 678970601], length 0
E..48.@.@.4...(2
....P..~..........A.......
..x.(xD.
17:20:00.663907 IP 131.253.40.50.http > 10.26.22.203.59342: Flags [R.], seq 1, ack 1, win 65, options [nop,nop,TS val 331839625 ecr 678970601], length 0
E..48.@.@.4...(2
....P..~..........A.......
..x.(xD.
17:20:00.663978 IP 10.26.22.203.59342 > 131.253.40.50.http: Flags [.], ack 1, win 8192, options [nop,nop,TS val 679031032 ecr 331839624], length 0
E..4.+@.@...
.....(2...P....~..... ..:.....
(y0...x.
17:20:00.664486 IP 131.253.40.50.http > 10.26.22.203.59342: Flags [R], seq 2125444601, win 0, length 0
E..(..@.@.m...(2
....P..~.......P.............
17:20:01.029723 IP 131.253.40.50.http > 10.26.22.203.59344: Flags [F.], seq 1857622550, ack 3637036786, win 55, options [nop,nop,TS val 331839990 ecr 678970746], length 0
E..4..@.@.....(2
....P..n..........7.......
..y.(xEz
17:20:01.029726 IP 131.253.40.50.http > 10.26.22.203.59344: Flags [R.], seq 1, ack 1, win 55, options [nop,nop,TS val 331839990 ecr 678970746], length 0
E..4..@.@.....(2
....P..n..........7.......
..y.(xEz
17:20:01.029788 IP 10.26.22.203.59344 > 131.253.40.50.http: Flags [.], ack 1, win 8195, options [nop,nop,TS val 679031395 ecr 331839990], length 0
E..4.i@.@...
.....(2...P....n..... ..:.....
(y2c..y.
17:20:01.030273 IP 131.253.40.50.http > 10.26.22.203.59344: Flags [R], seq 1857622551, win 0, length 0
E..(..@.@.m...(2
....P..n.......P...y.........
17:20:01.791858 IP ec2-54-226-191-234.compute-1.amazonaws.com.http > 10.26.22.203.59281: Flags [F.], seq 2181326951, ack 834974242, win 193, options [nop,nop,TS val 331840753 ecr 678967798], length 0
E..4..@.@..Y6...
....P....hg1.."...........
..|.(x9.
17:20:01.791940 IP 10.26.22.203.59281 > ec2-54-226-191-234.compute-1.amazonaws.com.http: Flags [.], ack 1, win 8192, options [nop,nop,TS val 679032153 ecr 331840753], length 0
E..4Q.@.@...
...6......P1.."..hh.. ........
(y5Y..|.
17:20:03.928471 IP 68.232.32.220.http > 10.26.22.203.58702: Flags [P.], seq 2527930306:2527930324, ack 964951661, win 114, options [nop,nop,TS val 331842889 ecr 678736620], length 18
E..F6.@.@.}aD. .
....P.N..'.9..m...r.......
...I(t..;%..[l.r:......m.K
17:20:03.928558 IP 10.26.22.203.58702 > 68.232.32.220.http: Flags [.], ack 18, win 8190, options [nop,nop,TS val 679034284 ecr 331842889], length 0
E..4..@.@...
...D. ..N.P9..m..'............
(y=....I
17:20:03.928628 IP 10.26.22.203.58702 > 68.232.32.220.http: Flags [P.], seq 1:8, ack 18, win 8192, options [nop,nop,TS val 679034284 ecr 331842889], length 7
E..;..@.@...
...D. ..N.P9..m..'... ........
(y=....I.U..-.X
17:20:03.929117 IP 68.232.32.220.http > 10.26.22.203.58702: Flags [.], ack 8, win 114, options [nop,nop,TS val 331842890 ecr 679034284], length 0
E..46.@.@.}rD. .
....P.N..'.9..t...r.S.....
...J(y=.
17:20:03.930281 IP 68.232.32.220.http > 10.26.22.203.58866: Flags [P.], seq 1458384287:1458384305, ack 545508656, win 114, options [nop,nop,TS val 331842891 ecr 678736621], length 18
E..F..@.@..vD. .
....P..V.-. ..0...ry......
...K(t.._...Q..P7K..p..._B
17:20:03.930322 IP 10.26.22.203.58866 > 68.232.32.220.http: Flags [.], ack 18, win 8190, options [nop,nop,TS val 679034285 ecr 331842891], length 0
E..4..@.@...
...D. ....P ..0V.-............
(y=....K
17:20:03.930385 IP 10.26.22.203.58866 > 68.232.32.220.http: Flags [P.], seq 1:8, ack 18, win 8192, options [nop,nop,TS val 679034285 ecr 331842891], length 7
E..;.l@.@...
...D. ....P ..0V.-... ........
(y=....Ko...L..
17:20:03.930871 IP 68.232.32.220.http > 10.26.22.203.58866: Flags [.], ack 8, win 114, options [nop,nop,TS val 331842892 ecr 679034285], length 0
E..4..@.@...D. .
....P..V.-. ..7...r.......
...L(y=.
17:20:05.708224 IP 10.26.22.203.59388 > www.rdio.com.http: Flags [.], ack 394, win 8192, length 0
E..(....@...
..........Px....-..P. ..%..
17:20:05.708246 IP 10.26.22.203.59385 > www.rdio.com.http: Flags [.], ack 1, win 8210, length 0
E..(X%..@...
..........P.....>}.P. ..%..
17:20:05.708734 IP www.rdio.com.http > 10.26.22.203.59388: Flags [.], ack 6863, win 385, options [nop,nop,TS val 331844669 ecr 679026052], length 0
E..4.a@.@..W....
....P...-..x........e.....
...=(y..
17:20:05.708736 IP www.rdio.com.http > 10.26.22.203.59385: Flags [.], ack 1, win 114, options [nop,nop,TS val 331844669 ecr 679015793], length 0
E..4F*@.@.......
....P...>}........r.v.....
...=(x.q
17:20:06.209078 IP 10.26.22.203.59389 > www.rdio.com.http: Flags [.], ack 1, win 8192, length 0
E..(|...@...
..........P.E..`...P. ..%..
17:20:06.209571 IP www.rdio.com.http > 10.26.22.203.59389: Flags [.], ack 1, win 114, options [nop,nop,TS val 331845170 ecr 679016101], length 0
E..4..@.@.......
....P..`....E.....r.\.....
...2(x..
17:20:06.709525 IP 10.26.22.203.59392 > a23-201-103-152.deploy.static.akamaitechnologies.com.http: Flags [.], ack 1, win 8192, length 0
E..(.B..@...
.....g....Pf2\.....P. ..`..
17:20:06.709558 IP 10.26.22.203.59390 > www.rdio.com.http: Flags [.], ack 1, win 8208, length 0
E..(....@...
..........Pi.....F.P. ..%..
17:20:06.710041 IP a23-201-103-152.deploy.static.akamaitechnologies.com.http > 10.26.22.203.59392: Flags [.], ack 1, win 55, options [nop,nop,TS val 331845671 ecr 679016691], length 0
E..4..@.@..y..g.
....P......f2\....7o......
...'(x..
17:20:06.710044 IP www.rdio.com.http > 10.26.22.203.59390: Flags [.], ack 1, win 114, options [nop,nop,TS val 331845671 ecr 679016645], length 0
E..4..@.@.......
....P....F.i......r.E.....
...'(x..
17:20:06.827655 IP 10.26.22.203.59296 > ec2-54-244-225-86.us-west-2.compute.amazonaws.com.http: Flags [F.], seq 1, ack 1, win 8212, options [nop,nop,TS val 679037171 ecr 331837080], length 0
E..4.a@.@...
...6..V...P.I...r.... .9V.....
(yH...n.
17:20:06.827768 IP 10.26.22.203.59286 > ec2-184-73-212-5.compute-1.amazonaws.com.http: Flags [F.], seq 1, ack 1, win 8192, options [nop,nop,TS val 679037171 ecr 331836916], length 0
E..4..@.@...
....I.....P.QF.A.t... ..Z.....
(yH...m.
17:20:06.827836 IP 10.26.22.203.59338 > ec2-54-225-216-126.compute-1.amazonaws.com.http: Flags [F.], seq 1, ack 1, win 8232, options [nop,nop,TS val 679037171 ecr 331836900], length 0
E..4#.@.@...
...6..~...P....i..... (0k.....
(yH...m.
17:20:06.827858 IP ec2-54-244-225-86.us-west-2.compute.amazonaws.com.http > 10.26.22.203.59296: Flags [.], ack 2, win 181, options [nop,nop,TS val 331845789 ecr 679037171], length 0
E..4.\@.@.z86..V
....P...r...I.............
....(yH.
17:20:06.827920 IP 10.26.22.203.59336 > ec2-54-225-216-126.compute-1.amazonaws.com.http: Flags [F.], seq 1, ack 1, win 8232, options [nop,nop,TS val 679037171 ecr 331836901], length 0
E..4..@.@...
...6..~...P.......x.. (0k.....
(yH...m.
17:20:06.827946 IP 10.26.22.203.59337 > ec2-54-225-216-126.compute-1.amazonaws.com.http: Flags [F.], seq 1, ack 1, win 8229, options [nop,nop,TS val 679037171 ecr 331837904], length 0
E..4..@.@...
...6..~...P.A..[..... %0k.....
(yH...q.
17:20:06.828052 IP 10.26.22.203.59281 > ec2-54-226-191-234.compute-1.amazonaws.com.http: Flags [F.], seq 1, ack 1, win 8192, options [nop,nop,TS val 679037171 ecr 331840753], length 0
E..4B3@.@...
...6......P1.."..hh.. ........
(yH...|.
17:20:06.828085 IP 10.26.22.203.59206 > c911a5b7.virtua.com.br.http: Flags [F.], seq 1, ack 1, win 8192, options [nop,nop,TS val 679037171 ecr 331838904], length 0
E..4..@.@...
........F.P.....^.y.. ........
(yH...u.
17:20:06.828584 IP ec2-184-73-212-5.compute-1.amazonaws.com.http > 10.26.22.203.59286: Flags [.], ack 2, win 181, options [nop,nop,TS val 331845789 ecr 679037171], length 0
E..4
.@.@....I..
....P..A.t..QF............
....(yH.
17:20:06.828586 IP ec2-54-225-216-126.compute-1.amazonaws.com.http > 10.26.22.203.59338: Flags [.], ack 2, win 91, options [nop,nop,TS val 331845789 ecr 679037171], length 0
E..4(.@.@...6..~
....P..i..........[nV.....
....(yH.
17:20:06.828588 IP ec2-54-225-216-126.compute-1.amazonaws.com.http > 10.26.22.203.59336: Flags [.], ack 2, win 91, options [nop,nop,TS val 331845789 ecr 679037171], length 0
E..4l.@.@...6..~
....P.....x.......[k......
....(yH.
17:20:06.828589 IP ec2-54-225-216-126.compute-1.amazonaws.com.http > 10.26.22.203.59337: Flags [.], ack 2, win 136, options [nop,nop,TS val 331845789 ecr 679037171], length 0
E..4D.@.@...6..~
....P..[....A.............
....(yH.
17:20:06.828590 IP ec2-54-226-191-234.compute-1.amazonaws.com.http > 10.26.22.203.59281: Flags [.], ack 2, win 193, options [nop,nop,TS val 331845789 ecr 679037171], length 0
E..4..@.@..X6...
....P....hh1..#.....C.....
....(yH.
17:20:06.828592 IP c911a5b7.virtua.com.br.http > 10.26.22.203.59206: Flags [.], ack 2, win 136, options [nop,nop,TS val 331845789 ecr 679037171], length 0
E..4.^@.@.......
....P.F.^.y...............
....(yH.
17:20:07.960532 IP c911a5b7.virtua.com.br.http > 10.26.22.203.59208: Flags [F.], seq 1777315821, ack 113265646, win 204, options [nop,nop,TS val 331846921 ecr 678978659], length 0
E..4..@.@.......
....P.Hi.....K.....\r.....
...	(xdc
17:20:07.960603 IP 10.26.22.203.59208 > c911a5b7.virtua.com.br.http: Flags [.], ack 1, win 8192, options [nop,nop,TS val 679038296 ecr 331846921], length 0
E..4j.@.@...
........H.P..K.i..... ........
(yMX...	
17:20:08.150165 IP ec2-23-23-203-51.compute-1.amazonaws.com.http > 10.26.22.203.59363: Flags [F.], seq 3542344310, ack 2610880806, win 87, options [nop,nop,TS val 331847111 ecr 678979506], length 0
E..4z.@.@......3
....P...#.v...&...W.......
....(xg.
17:20:08.150254 IP 10.26.22.203.59363 > ec2-23-23-203-51.compute-1.amazonaws.com.http: Flags [.], ack 1, win 8192, options [nop,nop,TS val 679038484 ecr 331847111], length 0
E..4..@.@...
......3...P...&.#.w.. ..V.....
(yN.....
17:20:08.150820 IP ec2-23-23-203-51.compute-1.amazonaws.com.http > 10.26.22.203.59370: Flags [F.], seq 2458320047, ack 2804431041, win 67, options [nop,nop,TS val 331847112 ecr 678981025], length 0
E..4U_@.@..5...3
....P.......(8....C.E.....
....(xm.
17:20:08.150853 IP 10.26.22.203.59370 > ec2-23-23-203-51.compute-1.amazonaws.com.http: Flags [.], ack 1, win 8192, options [nop,nop,TS val 679038484 ecr 331847112], length 0
E..4Y.@.@...
......3...P.(8....... ..V.....
(yN.....
17:20:08.151443 IP ec2-23-23-203-51.compute-1.amazonaws.com.http > 10.26.22.203.59365: Flags [F.], seq 3186699811, ack 2231449034, win 67, options [nop,nop,TS val 331847112 ecr 678979507], length 0
E..4..@.@......3
....P.....#..5....C.x.....
....(xg.
17:20:08.151472 IP 10.26.22.203.59365 > ec2-23-23-203-51.compute-1.amazonaws.com.http: Flags [.], ack 1, win 8202, options [nop,nop,TS val 679038485 ecr 331847112], length 0
E..4..@.@...
......3...P..5....$.. 
.V.....
(yN.....
17:20:08.941489 IP ec2-107-22-8-123.compute-1.amazonaws.com.http > 10.26.22.203.58488: Flags [P.], seq 3936610526:3936610693, ack 1763310809, win 501, options [nop,nop,TS val 331847902 ecr 679019054], length 167
E.....@.@..!k..{
....P.x....i..............
....(y..HTTP/1.1 200 OK
Content-Type: text/javascript; charset=UTF-8
Content-Length: 15
Connection: Keep-Alive
X-XSS-Protection: 0
Date: Mon, 25 Aug 2014 20:09:08 GMT


17:20:08.941494 IP ec2-107-22-8-123.compute-1.amazonaws.com.http > 10.26.22.203.58488: Flags [P.], seq 167:182, ack 1, win 501, options [nop,nop,TS val 331847902 ecr 679019054], length 15
E..C..@.@...k..{
....P.x....i........:.....
....(y..io.j[0]("8::");
17:20:08.941580 IP 10.26.22.203.58488 > ec2-107-22-8-123.compute-1.amazonaws.com.http: Flags [.], ack 167, win 8181, options [nop,nop,TS val 679039274 ecr 331847902], length 0
E..4.H@.@...
...k..{.x.Pi..................
(yQ*....
17:20:08.941627 IP 10.26.22.203.58488 > ec2-107-22-8-123.compute-1.amazonaws.com.http: Flags [.], ack 182, win 8191, options [nop,nop,TS val 679039274 ecr 331847902], length 0
E..4.u@.@...
...k..{.x.Pi..................
(yQ*....
17:20:08.944783 IP 10.26.22.203.58488 > ec2-107-22-8-123.compute-1.amazonaws.com.http: Flags [P.], seq 1:697, ack 182, win 8192, options [nop,nop,TS val 679039277 ecr 331847902], length 696
E...l.@.@...
...k..{.x.Pi......... ..T.....
(yQ-....GET /socket.io/1/jsonp-polling/DQZmyoQBRhRDiYErJcrl?t=1408998008943&i=0 HTTP/1.1
Host: io.express-io.org
Connection: keep-alive
Accept: */*
User-Agent: Mozilla/5.0 (Macintosh; Intel Mac OS X 10_9_3) AppleWebKit/537.36 (KHTML, like Gecko) Chrome/36.0.1985.143 Safari/537.36
Referer: http://express-io.org/live
Accept-Encoding: gzip,deflate,sdch
Accept-Language: en-US,en;q=0.8,de;q=0.6,es;q=0.4,pt;q=0.2
Cookie: connect.sid=s%3AdyWZGbaMsat%2BncAg16q1LQbe.URbdjzQb2SokoL5WgOBWpsny%2BDycGNBFZvFFwFrOGFU; __utma=104288852.1144617466.1408994695.1408994695.1408994695.1; __utmc=104288852; __utmz=104288852.1408994695.1.1.utmcsr=google|utmccn=(organic)|utmcmd=organic|utmctr=(not%20provided)


17:20:08.945546 IP ec2-107-22-8-123.compute-1.amazonaws.com.http > 10.26.22.203.58488: Flags [.], ack 697, win 501, options [nop,nop,TS val 331847906 ecr 679039277], length 0
E..4..@.@...k..{
....P.x....i........U.....
....(yQ-
17:20:11.083654 IP ec2-50-16-211-192.compute-1.amazonaws.com.http > 10.26.22.203.59167: Flags [F.], seq 558377678, ack 1332886865, win 501, options [nop,nop,TS val 331850044 ecr 678982667], length 0
E..4.M@.@.:.2...
....P..!H*.Or=Q....<A.....
...<(xt.
17:20:11.083700 IP 10.26.22.203.59167 > ec2-50-16-211-192.compute-1.amazonaws.com.http: Flags [.], ack 1, win 8192, options [nop,nop,TS val 679041408 ecr 331850044], length 0
E..4.-@.@...
...2......POr=Q!H*... .&......
(yY....<
17:20:12.033198 IP 200.174.107.8.http > 10.26.22.203.59180: Flags [F.], seq 1062750593, ack 1212564894, win 54, options [nop,nop,TS val 331850994 ecr 678960266], length 0
E..4\.@.@..~..k.
....P.,?XI.HFE....6%......
....(x..
17:20:12.033279 IP 10.26.22.203.59180 > 200.174.107.8.http: Flags [.], ack 1, win 8192, options [nop,nop,TS val 679042352 ecr 331850994], length 0
E..4..@.@...
.....k..,.PHFE.?XI... .T......
(y]0....
17:20:16.242827 IP 10.26.22.203.59388 > www.rdio.com.http: Flags [.], ack 394, win 8192, length 0
E..(M...@...
..........Px....-..P. ..%..
17:20:16.242850 IP 10.26.22.203.59385 > www.rdio.com.http: Flags [.], ack 1, win 8210, length 0
E..(?...@...
..........P.....>}.P. ..%..
17:20:16.243345 IP www.rdio.com.http > 10.26.22.203.59388: Flags [.], ack 6863, win 385, options [nop,nop,TS val 331855204 ecr 679026052], length 0
E..4.b@.@..V....
....P...-..x........>.....
...d(y..
17:20:16.243347 IP www.rdio.com.http > 10.26.22.203.59385: Flags [.], ack 1, win 114, options [nop,nop,TS val 331855204 ecr 679015793], length 0
E..4F+@.@.......
....P...>}........r.O.....
...d(x.q
17:20:16.743138 IP 10.26.22.203.59389 > www.rdio.com.http: Flags [.], ack 1, win 8192, length 0
E..(In..@...
..........P.E..`...P. ..%..
17:20:16.743641 IP www.rdio.com.http > 10.26.22.203.59389: Flags [.], ack 1, win 114, options [nop,nop,TS val 331855704 ecr 679016101], length 0
E..4..@.@.......
....P..`....E.....r.6.....
...X(x..
17:20:16.827540 IP 10.26.22.203.59363 > ec2-23-23-203-51.compute-1.amazonaws.com.http: Flags [F.], seq 1, ack 1, win 8192, options [nop,nop,TS val 679047133 ecr 331847111], length 0
E..4^Z@.@...
......3...P...&.#.w.. ..V.....
(yo.....
17:20:16.827579 IP 10.26.22.203.59365 > ec2-23-23-203-51.compute-1.amazonaws.com.http: Flags [F.], seq 1, ack 1, win 8202, options [nop,nop,TS val 679047133 ecr 331847112], length 0
E..4..@.@...
......3...P..5....$.. 
.V.....
(yo.....
17:20:16.827607 IP 10.26.22.203.59370 > ec2-23-23-203-51.compute-1.amazonaws.com.http: Flags [F.], seq 1, ack 1, win 8192, options [nop,nop,TS val 679047133 ecr 331847112], length 0
E..4..@.@...
......3...P.(8....... ..V.....
(yo.....
17:20:16.827653 IP 10.26.22.203.59167 > ec2-50-16-211-192.compute-1.amazonaws.com.http: Flags [F.], seq 1, ack 1, win 8192, options [nop,nop,TS val 679047133 ecr 331850044], length 0
E..4'.@.@...
...2......POr=Q!H*... .&......
(yo....<
17:20:16.827722 IP 10.26.22.203.59180 > 200.174.107.8.http: Flags [F.], seq 1, ack 1, win 8192, options [nop,nop,TS val 679047133 ecr 331850994], length 0
E..4.<@.@...
.....k..,.PHFE.?XI... .T......
(yo.....
17:20:16.827767 IP 10.26.22.203.59208 > c911a5b7.virtua.com.br.http: Flags [F.], seq 1, ack 1, win 8192, options [nop,nop,TS val 679047133 ecr 331846921], length 0
E..4.}@.@...
........H.P..K.i..... ........
(yo....	
17:20:16.828557 IP ec2-23-23-203-51.compute-1.amazonaws.com.http > 10.26.22.203.59363: Flags [.], ack 2, win 87, options [nop,nop,TS val 331855789 ecr 679047133], length 0
E..4z.@.@......3
....P...#.w...'...W.......
....(yo.
17:20:16.828559 IP ec2-23-23-203-51.compute-1.amazonaws.com.http > 10.26.22.203.59365: Flags [.], ack 2, win 67, options [nop,nop,TS val 331855789 ecr 679047133], length 0
E..4..@.@......3
....P.....$..5....C.g.....
....(yo.
17:20:16.828560 IP ec2-23-23-203-51.compute-1.amazonaws.com.http > 10.26.22.203.59370: Flags [.], ack 2, win 67, options [nop,nop,TS val 331855789 ecr 679047133], length 0
E..4U`@.@..4...3
....P.......(8....C.".....
....(yo.
17:20:16.828561 IP ec2-50-16-211-192.compute-1.amazonaws.com.http > 10.26.22.203.59167: Flags [.], ack 2, win 501, options [nop,nop,TS val 331855789 ecr 679047133], length 0
E..4.N@.@.:.2...
....P..!H*.Or=R....)......
....(yo.
17:20:16.828562 IP 200.174.107.8.http > 10.26.22.203.59180: Flags [.], ack 2, win 54, options [nop,nop,TS val 331855789 ecr 679047133], length 0
E..4\.@.@..}..k.
....P.,?XI.HFE....6.......
....(yo.
17:20:16.828563 IP c911a5b7.virtua.com.br.http > 10.26.22.203.59208: Flags [.], ack 2, win 204, options [nop,nop,TS val 331855789 ecr 679047133], length 0
E..4..@.@.......
....P.Hi.....K......R.....
....(yo.
17:20:16.927858 IP 10.26.22.203.59392 > a23-201-103-152.deploy.static.akamaitechnologies.com.http: Flags [.], ack 1, win 8192, length 0
E..(T...@...
.....g....Pf2\.....P. ..`..
17:20:16.927878 IP 10.26.22.203.59390 > www.rdio.com.http: Flags [.], ack 1, win 8208, length 0
E..(....@...
..........Pi.....F.P. ..%..
17:20:16.928476 IP a23-201-103-152.deploy.static.akamaitechnologies.com.http > 10.26.22.203.59392: Flags [.], ack 1, win 55, options [nop,nop,TS val 331855889 ecr 679016691], length 0
E..4..@.@..x..g.
....P......f2\....7G......
....(x..
17:20:16.928478 IP www.rdio.com.http > 10.26.22.203.59390: Flags [.], ack 1, win 114, options [nop,nop,TS val 331855889 ecr 679016645], length 0
E..4..@.@.......
....P....F.i......r.[.....
....(x..
17:20:20.411823 IP 10.26.22.203.59388 > www.rdio.com.http: Flags [P.], seq 6863:10667, ack 394, win 8192, options [nop,nop,TS val 679050704 ecr 331855204], length 3804
E.....@.@...
..........Px....-.... ........
(y}....dPOST /api/1/addTimedPlayInformation HTTP/1.1
Host: www.rdio.com
User-Agent: Mozilla/5.0 (Macintosh; Intel Mac OS X 10.9; rv:31.0) Gecko/20100101 Firefox/31.0
Accept: text/plain, */*; q=0.01
Accept-Language: pt-BR,pt;q=0.8,en-US;q=0.5,en;q=0.3
Accept-Encoding: gzip, deflate
Content-Type: application/x-www-form-urlencoded; charset=UTF-8
X-Requested-With: XMLHttpRequest
Referer: http://www.rdio.com/search/Team%20me/
Content-Length: 284
Cookie: optimizelySegments=%7B%22336009408%22%3A%22ff%22%2C%22338722019%22%3A%22referral%22%2C%22338756012%22%3A%22false%22%7D; optimizelyEndUserId=oeu1395410728606r0.6527429361346035; optimizelyBuckets=%7B%7D; fbm_100322856680770=base_domain=.www.rdio.com; s_fid=0E08BED5B44DB72C-0444715F5038467F; r=.eJyrVorPyU9OzElVslLIK83J0VFQigexjQ1NTc0sjcxA_FIg39DS0tgAwi0Dcg1qAcv9Do8.5y0MYs3vq_xMyHNDa50JOKYhzzs; _a="eyJkYXRlX2Nvb2tpZWQiOiAxMzk3NTk1ODQ3LCAicmVmIjogImh0dHA6Ly9lbWlsaWFuby5ib2NhbXVjaGFzLm9yZy9yZGlvLyIsICJyZXEiOiAiaHR0cDovL3d3dy5yZGlvLmNvbS9hcGkvc3dmLyIsICJ0eXBlIjogIm9yZ2FuaWMiLCAidWEiOiAiZGVza3RvcCIsICJtdWlkIjogImZhZjE0ZGNmNzIzYzgwOTIyZjhiY2NkZjkyZjU1NGIyY2U2NmM0ZDAifQ=="; ajs_user_id=1993026; ajs_group_id=null; _sio=476dd2fe-d7fd-453d-b3e9-b091209de308----1993026; _ga=GA1.1.1023500072.1397572294; amplitude_id=eyJkZXZpY2VJZCI6Ijk2ZDQwNWE1YWYxMTFiZDI4YmZhYjdiOTU3M2YyMTAyIiwidXNlcklkIjoiMTk5MzAyNiIsImdsb2JhbFVzZXJQcm9wZXJ0aWVzIjp7ImNyZWF0ZWQiOiIyMDEyLTA1LTI5VDE2OjQyOjQzLjAwMFoiLCJlbWFpbCI6ImVtaWxpYW5vZWxvaUBnbWFpbC5jb20iLCJmaXJzdE5hbWUiOiJFbWlsaWFubyIsImxhc3ROYW1lIjoiRWxvaSBTLiBCYXJib3NhIiwidXNlcm5hbWUiOiJlbWlsaWFub2Vsb2kiLCJnZW5kZXIiOiJtIiwibG9jYWxlIjpudWxsLCJsb2dnZWRJbiI6dHJ1ZSwiY29tcGQiOmZhbHNlLCJzdWJTdGF0dXMiOiJ1bmxpbWl0ZWQiLCJtdXNpY0ZlZWQiOmZhbHNlLCJ1c2VyRE1BQ29kZSI6bnVsbCwiY291bnRyeUNvZGUiOiJCUiIsInJlZ2lvbiI6IkJSIiwiaWQiOjE5OTMwMjZ9fQ==; __qca=P0-1261615019-1397572361567; _sio=86d59868-4618-4b82-a2e9-bcf7853d045a----1993026; mp_e7a2e1a771143fbc6737076d26155f0f_mixpanel=%7B%22distinct_id%22%3A%201993026%2C%22%24initial_referrer%22%3A%20%22%24direct%22%2C%22%24initial_referring_domain%22%3A%20%22%24direct%22%2C%22mp_name_tag%22%3A%20%22emilianoeloi%40gmail.com%22%2C%22gender%22%3A%20%22m%22%2C%22locale%22%3A%20null%2C%22loggedIn%22%3A%20true%2C%22compd%22%3A%20false%2C%22subStatus%22%3A%20%22unlimited%22%2C%22id%22%3A%201993026%2C%22%24created%22%3A%20%222012-05-29T16%3A42%3A43.000Z%22%2C%22%24email%22%3A%20%22emilianoeloi%40gmail.com%22%2C%22%24first_name%22%3A%20%22Emiliano%22%2C%22%24last_name%22%3A%20%22Eloi%20S.%20Barbosa%22%2C%22%24name%22%3A%20%22Emiliano%20Eloi%20S.%20Barbosa%22%2C%22%24username%22%3A%20%22emilianoeloi%22%7D; optimizelyCustomEvents=%7B%22oeu1395410728606r0.6527429361346035%22%3A%5B%22main_search_focus%22%5D%7D; user_segment=Prospect; _ap=%7B%22t%22%3A1408971397862%7D; s_cc=true; s_sq=%5B%5BB%5D%5D; fbsr_100322856680770=9po4dz5A5Cupe-qwc8D5ioog9TFMmBmsH4BDrFSj20o.eyJhbGdvcml0aG0iOiJITUFDLVNIQTI1NiIsImNvZGUiOiJBUURmR2I0d0V6R0NfVnBldDNoS2dOV2xJd3J3UXdvNGtpUE1udndaaWp4cmJUb1VabmNHNkpZdmNlRXR4UzRvZlZoYjJoUXlENXZkWGpsOGdaZjBnZ0o4OUtpODVscmMzYTNkc0s0eTdOWWJ6aEpIY3dyYjlVRk9Ec0tsMEhpTGRiZTR4bDB0TFVBRTdrXzQ2Tzl1bHVoUmxSUkVhYTgzWi1YN1NET3Nhc3FBZUE3cWtWN1g0Snk1a0cxLWstbWNDajFrLUJYTi1GeHFYcDI4STFBSmNmbnAxcHZvWkcwLTN2UklrN0FERHI2c2xJUE9QdGpZVXlacF9LOHNVVEVOM2JtRVZNRWhZRDIzd0V0d1pNVTM4WEtTbEJ2OHdjRi1pVnFBVUZJM1dEMjBCS3BwWlpseWJuS3I0VFk4YjNrc1JwbEtKRTBqdFk2UVdjMXNQbE44ME41QyIsImlzc3VlZF9hdCI6MTQwODk5NzgzNSwidXNlcl9pZCI6IjEwNDE4NzQxNTEifQ
Connection: keep-alive
Pragma: no-cache
Cache-Control: no-cache

txid=53fb9a67001e694201563cef74720000001592b3000000000000425200020036000000005203b4c95140&time=30&extras%5B%5D=*.WEB&method=addTimedPlayInformation&_authorization_key=eyJyYW5kIjogODgyMDU1MjQ0LCAia2V5IjogInMxOTkzMDI2IiwgInRpbWUiOiAxNDA4OTcxMzk0fQ.oGMzH9Dke3oKgYhK5_iWTBxZqzI&v=20140806
17:20:20.412985 IP www.rdio.com.http > 10.26.22.203.59388: Flags [.], ack 8311, win 408, options [nop,nop,TS val 331859374 ecr 679050704], length 0
E..4.c@.@..U....
....P...-..x..N....H......
....(y}.
17:20:20.412987 IP www.rdio.com.http > 10.26.22.203.59388: Flags [.], ack 9759, win 430, options [nop,nop,TS val 331859374 ecr 679050704], length 0
E..4.d@.@..T....
....P...-..x.......C+.....
....(y}.
17:20:20.412988 IP www.rdio.com.http > 10.26.22.203.59388: Flags [.], ack 10667, win 453, options [nop,nop,TS val 331859374 ecr 679050704], length 0
E..4.e@.@..S....
....P...-..x.......?......
....(y}.
17:20:20.777044 IP www.rdio.com.http > 10.26.22.203.59388: Flags [P.], seq 394:755, ack 10667, win 453, options [nop,nop,TS val 331859738 ecr 679050704], length 361
E....f@.@.......
....P...-..x..............
....(y}.HTTP/1.1 200 OK
Server: nginx/1.2.4
Date: Mon, 25 Aug 2014 20:20:20 GMT
Content-Type: application/json
Content-Length: 30
Connection: keep-alive
X-srv: srv-208-12
X-Client-Version: 2ddcc924748661504ddc8a6b82072c652e74f5e4
Content-Language: pt-br
Vary: Accept-Language, Cookie
Cache-Control: no-cache
Access-Control-Allow-Origin: *
X-Version: 720


17:20:20.777049 IP www.rdio.com.http > 10.26.22.203.59388: Flags [P.], seq 755:785, ack 10667, win 453, options [nop,nop,TS val 331859738 ecr 679050704], length 30
E..R.g@.@..3....
....P...-.ex.......pv.....
....(y}.{"status": "ok", "result": {}}
17:20:20.777128 IP 10.26.22.203.59388 > www.rdio.com.http: Flags [.], ack 755, win 8169, options [nop,nop,TS val 679051067 ecr 331859738], length 0
E..4..@.@...
..........Px....-.e.....1.....
(y.;....
17:20:20.777156 IP 10.26.22.203.59388 > www.rdio.com.http: Flags [.], ack 785, win 8167, options [nop,nop,TS val 679051067 ecr 331859738], length 0
E..4j.@.@...
..........Px....-.......1.....
(y.;....
17:20:21.545532 IP 10.26.22.203.43568 > l1.ycs.vip.dcb.yahoo.com.http: Flags [R.], seq 519140173, ack 3312888375, win 8192, length 0
E..(.8@.?...
.....8..0.P..sM.v.7P. .....
17:20:24.781260 IP 10.26.22.203.40044 > 64.233.186.84.http: Flags [F.], seq 1061370161, ack 1920922487, win 74, options [nop,nop,TS val 52103402 ecr 330238556], length 0
E..4rE@.?...
...@..T.l.P?C91r~.w...J.......
......
\
17:20:24.782706 IP 10.26.22.203.45611 > c911a5db.virtua.com.br.http: Flags [F.], seq 751930576, ack 2443884431, win 74, options [nop,nop,TS val 52103402 ecr 330060347], length 0
E..4..@.?...
........+.P,..........J.\.....
......R;
17:20:24.801362 IP 10.26.22.203.39946 > c911a5a2.virtua.com.br.http: Flags [F.], seq 1494317721, ack 2028859165, win 71, options [nop,nop,TS val 52103402 ecr 330060858], length 0
E..4?v@.?...
........
.PY.z.x......G.......
......T:
17:20:24.817141 IP 10.26.22.203.39946 > c911a5a2.virtua.com.br.http: Flags [F.], seq 0, ack 1, win 71, options [nop,nop,TS val 52103426 ecr 330060858], length 0
E..4?w@.?...
........
.PY.z.x......G.......
..	...T:
17:20:24.826234 IP 10.26.22.203.45611 > c911a5db.virtua.com.br.http: Flags [F.], seq 0, ack 1, win 74, options [nop,nop,TS val 52103438 ecr 330060347], length 0
E..4..@.?...
........+.P,..........J.8.....
..	...R;
17:20:25.150179 IP 10.26.22.203.40044 > 64.233.186.84.http: Flags [F.], seq 0, ack 1, win 74, options [nop,nop,TS val 52103467 ecr 330238556], length 0
E..4rF@.?...
...@..T.l.P?C91r~.w...J.......
..	+..
\
17:20:25.176928 IP 10.26.22.203.39946 > c911a5a2.virtua.com.br.http: Flags [F.], seq 0, ack 1, win 71, options [nop,nop,TS val 52103474 ecr 330060858], length 0
E..4?x@.?...
........
.PY.z.x......G.......
..	2..T:
17:20:25.519294 IP 10.26.22.203.45611 > c911a5db.virtua.com.br.http: Flags [F.], seq 0, ack 1, win 74, options [nop,nop,TS val 52103510 ecr 330060347], length 0
E..4..@.?...
........+.P,..........J.......
..	V..R;
17:20:26.114780 IP 10.26.22.203.39946 > c911a5a2.virtua.com.br.http: Flags [F.], seq 0, ack 1, win 71, options [nop,nop,TS val 52103570 ecr 330060858], length 0
E..4?y@.?...
........
.PY.z.x......G.8.....
..	...T:
17:20:26.296746 IP 10.26.22.203.59385 > www.rdio.com.http: Flags [.], ack 1, win 8210, length 0
E..(....@...
..........P.....>}.P. ..%..
17:20:26.297245 IP www.rdio.com.http > 10.26.22.203.59385: Flags [.], ack 1, win 114, options [nop,nop,TS val 331865258 ecr 679015793], length 0
E..4F,@.@.......
....P...>}........rv	.....
....(x.q
17:20:26.402041 IP 10.26.22.203.40044 > 64.233.186.84.http: Flags [F.], seq 0, ack 1, win 74, options [nop,nop,TS val 52103597 ecr 330238556], length 0
E..4rG@.?...
...@..T.l.P?C91r~.w...J.U.....
..	...
\
17:20:26.797816 IP 10.26.22.203.59389 > www.rdio.com.http: Flags [.], ack 1, win 8192, length 0
E..(9...@...
..........P.E..`...P. ..%..
17:20:26.798309 IP www.rdio.com.http > 10.26.22.203.59389: Flags [.], ack 1, win 114, options [nop,nop,TS val 331865759 ecr 679016101], length 0
E..4..@.@.......
....P..`....E.....rW......
....(x..
17:20:26.963011 IP 10.26.22.203.45611 > c911a5db.virtua.com.br.http: Flags [F.], seq 0, ack 1, win 74, options [nop,nop,TS val 52103654 ecr 330060347], length 0
E..4..@.?...
........+.P,..........J.`.....
..	...R;
17:20:27.036168 IP 200.174.107.26.http > 10.26.22.203.59226: Flags [F.], seq 1928184338, ack 491072962, win 54, options [nop,nop,TS val 331865997 ecr 678963830], length 0
E..4..@.@..=..k.
....P.Zr....E-....6s......
....(x*v
17:20:27.036237 IP 10.26.22.203.59226 > 200.174.107.26.http: Flags [.], ack 1, win 8192, options [nop,nop,TS val 679057289 ecr 331865997], length 0
E..4..@.@...
.....k..Z.P.E-.r..... .T......
(y......
17:20:27.298871 IP 10.26.22.203.59392 > a23-201-103-152.deploy.static.akamaitechnologies.com.http: Flags [.], ack 1, win 8192, length 0
E..(M...@...
.....g....Pf2\.....P. ..`..
17:20:27.298898 IP 10.26.22.203.59390 > www.rdio.com.http: Flags [.], ack 1, win 8208, length 0
E..(....@...
..........Pi.....F.P. ..%..
17:20:27.300354 IP a23-201-103-152.deploy.static.akamaitechnologies.com.http > 10.26.22.203.59392: Flags [.], ack 1, win 55, options [nop,nop,TS val 331866260 ecr 679016691], length 0
E..4..@.@..w..g.
....P......f2\....7.a.....
....(x..
17:20:27.300356 IP www.rdio.com.http > 10.26.22.203.59390: Flags [.], ack 1, win 114, options [nop,nop,TS val 331866260 ecr 679016645], length 0
E..4..@.@.......
....P....F.i......r.......
....(x..
17:20:28.038208 IP 10.26.22.203.39946 > c911a5a2.virtua.com.br.http: Flags [F.], seq 0, ack 1, win 71, options [nop,nop,TS val 52103762 ecr 330060858], length 0
E..4?z@.?...
........
.PY.z.x......G.x.....
..
R..T:
17:20:29.025765 IP 10.26.22.203.40044 > 64.233.186.84.http: Flags [F.], seq 0, ack 1, win 74, options [nop,nop,TS val 52103858 ecr 330238556], length 0
E..4rH@.?...
...@..T.l.P?C91r~.w...J.P.....
..
...
\
17:20:29.247106 IP ec2-107-22-8-123.compute-1.amazonaws.com.http > 10.26.22.203.58488: Flags [P.], seq 182:349, ack 697, win 501, options [nop,nop,TS val 331868208 ecr 679039277], length 167
E.....@.@...k..{
....P.x....i.......F......
...0(yQ-HTTP/1.1 200 OK
Content-Type: text/javascript; charset=UTF-8
Content-Length: 15
Connection: Keep-Alive
X-XSS-Protection: 0
Date: Mon, 25 Aug 2014 20:09:28 GMT


17:20:29.247110 IP ec2-107-22-8-123.compute-1.amazonaws.com.http > 10.26.22.203.58488: Flags [P.], seq 349:364, ack 697, win 501, options [nop,nop,TS val 331868208 ecr 679039277], length 15
E..C..@.@...k..{
....P.x...;i.......>{.....
...0(yQ-io.j[0]("8::");
17:20:29.247195 IP 10.26.22.203.58488 > ec2-107-22-8-123.compute-1.amazonaws.com.http: Flags [.], ack 349, win 8181, options [nop,nop,TS val 679059493 ecr 331868208], length 0
E..4..@.@...
...k..{.x.Pi......;...........
(y.%...0
17:20:29.247223 IP 10.26.22.203.58488 > ec2-107-22-8-123.compute-1.amazonaws.com.http: Flags [.], ack 364, win 8180, options [nop,nop,TS val 679059493 ecr 331868208], length 0
E..4W.@.@...
...k..{.x.Pi......J...........
(y.%...0
17:20:29.250220 IP 10.26.22.203.58488 > ec2-107-22-8-123.compute-1.amazonaws.com.http: Flags [P.], seq 697:1393, ack 364, win 8192, options [nop,nop,TS val 679059496 ecr 331868208], length 696
E.....@.@...
...k..{.x.Pi......J.. ..T.....
(y.(...0GET /socket.io/1/jsonp-polling/DQZmyoQBRhRDiYErJcrl?t=1408998029249&i=0 HTTP/1.1
Host: io.express-io.org
Connection: keep-alive
Accept: */*
User-Agent: Mozilla/5.0 (Macintosh; Intel Mac OS X 10_9_3) AppleWebKit/537.36 (KHTML, like Gecko) Chrome/36.0.1985.143 Safari/537.36
Referer: http://express-io.org/live
Accept-Encoding: gzip,deflate,sdch
Accept-Language: en-US,en;q=0.8,de;q=0.6,es;q=0.4,pt;q=0.2
Cookie: connect.sid=s%3AdyWZGbaMsat%2BncAg16q1LQbe.URbdjzQb2SokoL5WgOBWpsny%2BDycGNBFZvFFwFrOGFU; __utma=104288852.1144617466.1408994695.1408994695.1408994695.1; __utmc=104288852; __utmz=104288852.1408994695.1.1.utmcsr=google|utmccn=(organic)|utmcmd=organic|utmctr=(not%20provided)


17:20:29.251321 IP ec2-107-22-8-123.compute-1.amazonaws.com.http > 10.26.22.203.58488: Flags [.], ack 1393, win 501, options [nop,nop,TS val 331868212 ecr 679059496], length 0
E..4..@.@...k..{
....P.x...Ji..I...........
...4(y.(
17:20:29.857906 IP 10.26.22.203.45611 > c911a5db.virtua.com.br.http: Flags [F.], seq 0, ack 1, win 74, options [nop,nop,TS val 52103943 ecr 330060347], length 0
E..4..@.?...
........+.P,..........J.?.....
......R;
17:20:30.035114 IP 200.174.107.26.http > 10.26.22.203.59310: Flags [F.], seq 3783054243, ack 3571605596, win 91, options [nop,nop,TS val 331868996 ecr 678967319], length 0
E..4./@.@./...k.
....P...|....`\...[.......
...D(x8.
17:20:30.035187 IP 10.26.22.203.59310 > 200.174.107.26.http: Flags [.], ack 1, win 8192, options [nop,nop,TS val 679060280 ecr 331868996], length 0
E..4.}@.@...
.....k....P..`\.|.... .T......
(y.8...D
17:20:31.186777 IP 10.26.22.203.36704 > static.200.143.161.100.datacenter1.com.br.http: Flags [S], seq 2731052533, win 65535, options [mss 1460,nop,wscale 4,nop,nop,TS val 240758627 ecr 0,sackOK,eol], length 0
E..@..@.?...
......d.`.P............-..............
.Y.c........
17:20:31.322706 IP 10.26.22.203.59388 > www.rdio.com.http: Flags [.], ack 785, win 8192, length 0
E..(:r..@...
..........Px....-..P. ..%..
17:20:31.323369 IP www.rdio.com.http > 10.26.22.203.59388: Flags [.], ack 10667, win 453, options [nop,nop,TS val 331870284 ecr 679051067], length 0
E..4.h@.@..P....
....P...-..x..............
...L(y.;
17:20:31.502072 IP static.200.143.161.100.datacenter1.com.br.http > 10.26.22.203.36704: Flags [S.], seq 3923977548, ack 2731052534, win 5792, options [mss 1460,sackOK,TS val 331870463 ecr 240758627,nop,wscale 7], length 0
E..<..@.@......d
....P.`..%L.........T.........
.....Y.c....
17:20:31.660166 IP 10.26.22.203.36704 > static.200.143.161.100.datacenter1.com.br.http: Flags [.], ack 1, win 8235, options [nop,nop,TS val 240759095 ecr 331870463], length 0
E..4..@.?...
......d.`.P......%M.. +7......
.Y.7....
17:20:31.678573 IP 10.26.22.203.36704 > static.200.143.161.100.datacenter1.com.br.http: Flags [P.], seq 1:516, ack 1, win 8235, options [nop,nop,TS val 240759119 ecr 331870463], length 515
E..7*t@.?...
......d.`.P......%M.. +.
.....
.Y.O....POST /api/rest/AutenticarUsuario?email=raphael.oliveira@akzonobel.com&senha=defa50a7babc2b727c44fe4e03905bf4 HTTP/1.1
Host: www.clubedacor.com.br
X-Coral-API-Key: 932d92f5fc357e13
Accept: */*
Accept-Encoding: gzip, deflate
Content-Length: 0
Accept-Language: pt, en, fr, de, ja, nl, it, es, pt-PT, da, fi, nb, sv, ko, zh-Hans, zh-Hant, ru, pl, tr, uk, ar, hr, cs, el, he, ro, sk, th, id, ms, en-GB, ca, hu, vi, en-us;q=0.8
Connection: keep-alive
User-Agent: ClubeDaCor/1.3 (iPhone; iOS 6.1.3; Scale/1.00)


17:20:31.679258 IP static.200.143.161.100.datacenter1.com.br.http > 10.26.22.203.36704: Flags [.], ack 516, win 54, options [nop,nop,TS val 331870640 ecr 240759119], length 0
E..4..@.@......d
....P.`..%M.......6T......
.....Y.O
17:20:31.888612 IP 10.26.22.203.39946 > c911a5a2.virtua.com.br.http: Flags [F.], seq 0, ack 1, win 71, options [nop,nop,TS val 52104147 ecr 330060858], length 0
E..4?{@.?...
........
.PY.z.x......G.......
......T:
17:20:32.607141 IP static.200.143.161.100.datacenter1.com.br.http > 10.26.22.203.36704: Flags [P.], seq 1:260, ack 516, win 54, options [nop,nop,TS val 331871568 ecr 240759119], length 259
E..7..@.@......d
....P.`..%M.......6.$.....
...P.Y.OHTTP/1.1 200 OK
Cache-Control: no-cache
Pragma: no-cache
Content-Type: application/json; charset=utf-8
Expires: -1
Server: Microsoft-IIS/7.5
X-AspNet-Version: 4.0.30319
X-Powered-By: ASP.NET
Date: Mon, 25 Aug 2014 20:20:32 GMT
Content-Length: 225


17:20:32.607144 IP static.200.143.161.100.datacenter1.com.br.http > 10.26.22.203.36704: Flags [P.], seq 260:485, ack 516, win 54, options [nop,nop,TS val 331871568 ecr 240759119], length 225
E.....@.@..4...d
....P.`..&P.......6.......
...P.Y.O{"Extrato":[{"dataTransacao":"2014-05-08T00:00:00","acao":"Cadastro","pontos":10.0,"status":true}],"id":4786727,"nome":"RAPHAEL OLIVEIRA","totalPontos":0.0,"dataUltimoAcesso":"2014-08-25T17:20:31","sessao":"8677F7BA995E4BA1"}
17:20:32.782605 IP 10.26.22.203.36704 > static.200.143.161.100.datacenter1.com.br.http: Flags [.], ack 260, win 8219, options [nop,nop,TS val 240760205 ecr 331871568], length 0
E..4.x@.?...
......d.`.P......&P.. .,$.....
.Y.....P
17:20:32.829171 IP 10.26.22.203.36704 > static.200.143.161.100.datacenter1.com.br.http: Flags [.], ack 485, win 8205, options [nop,nop,TS val 240760254 ecr 331871568], length 0
E..4.~@.?...
......d.`.P......'1.. + .....
.Y.....P
17:20:34.223793 IP 10.26.22.203.40044 > 64.233.186.84.http: Flags [F.], seq 0, ack 1, win 74, options [nop,nop,TS val 52104380 ecr 330238556], length 0
E..4rI@.?...
...@..T.l.P?C91r~.w...J.F.....
......
\

253 packets captured
2515 packets received by filter
0 packets dropped by kernel
